{
  "version": 1,
  "revision": 1,
  "approved_by": "D-1",
  "qa": {
    "max_rounds": 2,
    "jank_checklist": true,
    "viewports": [
      "desktop",
      "phone"
    ],
    "themes": [
      "light",
      "dark"
    ]
  },
  "flows": {
    "J-1": {
      "covers": [
        "P-1"
      ],
      "given": "the search page is showing results for \"soup\"",
      "when": "the user clears the search box",
      "then": "within 300 ms the spinner is gone and the \"Type to search recipes\" empty state shows",
      "continues": [
        "show the spinner while a non-empty query is loading, then its results",
        "show the error banner when the request fails",
        "keep the ?q= URL parameter in step with the box"
      ],
      "check": {
        "method": "app",
        "evidence": "screenshots of the cleared state on desktop light and phone dark, plus one of a loading query, in evidence/qa/"
      }
    },
    "S-1": {
      "covers": [
        "P-1"
      ],
      "run": "pnpm test src/search",
      "expect": "all tests pass, including \"clears loading when the query is emptied\""
    }
  },
  "steps": [
    {
      "id": "build-p1",
      "actor": "implementer",
      "do": "build",
      "package": "P-1",
      "skills": [
        "tdd"
      ]
    },
    {
      "id": "verify",
      "actor": "implementer",
      "do": "verify",
      "flows": [
        "J-1",
        "S-1"
      ]
    },
    {
      "id": "qa",
      "actor": "implementer",
      "do": "qa",
      "flows": [
        "J-1"
      ],
      "spawn": "verifier",
      "max_rounds": 2
    },
    {
      "id": "pr",
      "actor": "implementer",
      "do": "pr"
    },
    {
      "id": "review-final",
      "actor": "orchestrator",
      "do": "review",
      "scope": "all",
      "profile": "bigbrain/reviewer",
      "note": "End review of the whole PR."
    }
  ]
}
