{
  "$schema": "control-flow.schema.json",
  "version": 1,
  "revision": 1,
  "approved_by": "D-3",
  "qa": {
    "max_rounds": 2,
    "mockups": [],
    "jank_checklist": true,
    "viewports": ["desktop"],
    "themes": ["light", "dark"]
  },
  "flows": {
    "J-1": {
      "covers": ["SC-1", "P-1", "P-2"],
      "given": "a note titled \"Trip plan\" with a heading, a checklist and a link",
      "when": "I choose Download as Markdown from the note's menu",
      "then": "trip-plan-n42.md downloads, its first line is \"# Trip plan\", and the checklist and link read the same as in the app",
      "check": { "method": "app", "evidence": "J-1-download-desktop-light.svg" }
    },
    "J-2": {
      "covers": ["SC-2", "P-1", "P-2"],
      "given": "an account with three notes, two of them titled \"Ideas\"",
      "when": "I click Export all notes in Settings",
      "then": "jotter-notes-2026-10-14.zip downloads with three .md files whose names are all different",
      "continues": ["the Settings page still saves the theme choice"],
      "check": { "method": "app", "evidence": "J-2-export-all-desktop-light.svg" }
    },
    "J-3": {
      "covers": ["SC-3", "P-1"],
      "given": "a note titled \"Q3/Q4 plans: draft?\"",
      "when": "I download it as Markdown, and again inside Export all notes",
      "then": "the file is named q3-q4-plans-draft-n57.md in both cases and the zip has no folders",
      "check": { "method": "app", "evidence": "J-3-unsafe-title-desktop-light.svg" }
    },
    "S-1": {
      "covers": ["P-1"],
      "run": "pnpm test --filter server -- export",
      "expect": "0 failures, including the serializer and file-name cases"
    }
  },
  "steps": [
    { "id": "build-P-1", "actor": "implementer", "do": "build", "package": "P-1", "skills": ["tdd"] },
    { "id": "verify-P-1", "actor": "implementer", "do": "verify", "flows": ["S-1"] },
    { "id": "build-P-2", "actor": "implementer", "do": "build", "package": "P-2" },
    { "id": "verify-P-2", "actor": "implementer", "do": "verify", "flows": ["S-1"] },
    { "id": "qa", "actor": "implementer", "do": "qa", "flows": ["J-1", "J-2", "J-3"], "spawn": "verifier" },
    { "id": "pr", "actor": "implementer", "do": "pr" },
    { "id": "review-final", "actor": "orchestrator", "do": "review", "scope": "all", "profile": "bigbrain/reviewer:codex" }
  ]
}
